{
  "contract_version": "1.0",
  "event_id": "018f0f6f-a3d2-7d09-bd19-d6325d4bc77a",
  "room_id": "018f0f6e-7b6a-7c10-8af1-7f4c620b93c1",
  "event_sequence": 10,
  "occurred_at": "2026-08-30T16:03:00.000Z",
  "kind": "speech",
  "actor_id": "018f0f6e-bbc1-78c1-a23a-46588c34f46e",
  "visibility": "room",
  "payload": {"text": "Let's compare both approaches before deciding."},
  "content_digest": "sha256:be6ed51fbb2b40a38eeb34dc6ed00628e2b2ba2ed0ec07b0ddff02f98aa1894d"
}
